word,word definition,Sentence 1,Sentence 2,Sentence 3,Sentence 4,Sentence 5,Sentence 6
overt,"done or shown openly; not secret or hidden.","Her overt laughter let everyone know she found the joke hilarious.","The company's overt support for environmental causes boosted its reputation.","He made an overt attempt to apologize after the argument.","There was overt hostility between the two rival teams.","The politician's overt gestures of goodwill won over many voters.","Security at the event was overt, with uniformed guards at every entrance."
congenial,"pleasant because of having qualities or interests similar to one's own; friendly and agreeable.","The workplace felt congenial, making it easy to collaborate.","She found her new neighbors to be congenial and welcoming.","Their congenial personalities made the group project enjoyable.","The café had a congenial atmosphere that encouraged conversation.","He sought out congenial companions for his hiking trips.","Congenial weather made the outdoor wedding a success."
duplicity,"deceitfulness; acting in two different ways to different people about the same matter.","The manager's duplicity was revealed when he was caught lying to both teams.","He was accused of duplicity after promising loyalty to both parties.","Her duplicity in the contract negotiations led to legal troubles.","The spy's duplicity was essential to her undercover work.","Public trust was lost due to the politician's duplicity.","They condemned the duplicity involved in the cover-up."
aristocracy,"the highest social class in certain societies, often holding hereditary titles or offices.","The aristocracy held lavish parties in their ancestral homes.","Many members of the aristocracy were educated at prestigious universities.","The revolution aimed to dismantle the power of the aristocracy.","He married into the aristocracy, gaining both status and influence.","Art collections of the aristocracy shaped cultural trends.","The decline of the aristocracy changed the face of European politics."
courtiers,"attendants or advisers at a royal court, especially those who flatter to gain favor.","The courtiers vied for the king's attention with clever compliments.","She distrusted the courtiers, sensing their motives were not sincere.","The palace was filled with courtiers eager to curry favor.","Stories of ambitious courtiers have inspired many historical dramas.","Courtiers often influenced important decisions behind the scenes.","The queen kept only a handful of trusted courtiers."
refine,"to remove impurities or unwanted elements from a substance; to improve by making small changes.","The chef worked to refine the recipe until it was perfect.","Engineers continually refine the design for better performance.","She took a class to refine her public speaking skills.","They refine crude oil to produce gasoline.","Artists often refine their technique over many years.","The company refined its hiring process to attract top talent."
dilemma,"a situation in which a difficult choice has to be made between two or more alternatives.","He faced a dilemma: accept the job offer or stay close to family.","Choosing between honesty and loyalty presented her with a dilemma.","The committee's dilemma was whether to cut funding or raise fees.","Environmental policies often involve moral dilemmas.","The doctor encountered a dilemma when both treatments had risks.","Travelers sometimes experience a dilemma when flights are overbooked."
paragon,"a person or thing regarded as a perfect example of a particular quality.","She was considered a paragon of kindness in her community.","The sculpture is a paragon of classical beauty.","He aimed to be a paragon of professionalism at work.","Their service was a paragon of efficiency and courtesy.","The athlete became a paragon of perseverance after his recovery.","That book is often cited as a paragon of modern literature."
invariably,"always; in every case or on every occasion.","He invariably arrives early to every meeting.","Rain invariably spoils their outdoor plans.","The results invariably showed the same trend.","She invariably orders the same dish at the restaurant.","Mistakes invariably happen when rushing.","Their efforts invariably lead to success."
elegance,"the quality of being graceful, stylish, and attractive in appearance or manner.","Her elegance was evident in both her dress and manners.","The simplicity of the design gave it elegance.","He spoke with elegance, captivating the audience.","The ballroom was decorated with understated elegance.","She moved across the stage with remarkable elegance.","The solution to the problem impressed everyone with its elegance."
coercion,"the practice of persuading someone to do something by using force or threats.","The confession was obtained through coercion, making it inadmissible.","He resisted attempts at coercion from his peers.","Laws strictly prohibit coercion in business deals.","She felt coercion to sign the contract against her will.","The investigation revealed coercion in the voting process.","Coercion is sometimes subtle but always unethical."
outright,"completely and immediately; without reservation or concealment.","She rejected the proposal outright without hesitation.","He admitted his mistake outright to avoid further trouble.","The company denied the allegations outright.","They won the game outright, leaving no doubt about the outcome.","He bought the car outright instead of financing it.","Their intentions were stated outright from the beginning."
treachery,"betrayal of trust; deceptive action or nature.","The general's treachery was discovered just before the battle.","She never forgave the treachery of her former friend.","Treachery within the organization led to its downfall.","The tale is filled with intrigue and treachery.","He was accused of treachery for leaking confidential information.","Their alliance ended in mutual treachery."
vigilance,"the action or state of keeping careful watch for possible danger or difficulties.","The guards maintained constant vigilance throughout the night.","Vigilance is required to prevent data breaches.","Parents must exercise vigilance when children play near water.","Her vigilance helped the team avoid costly mistakes.","Vigilance against fraud is vital in online transactions.","Wildlife rangers practice vigilance to protect endangered species."
tactical,"relating to or constituting actions carefully planned to gain a specific end.","The team made a tactical retreat to regroup.","Tactical decisions in business can determine long-term success.","He used tactical voting to support his preferred candidate.","The army executed a tactical maneuver to outflank the enemy.","She took a tactical approach to negotiating her salary.","Tactical gear is essential for certain professions."
tact,"skill and sensitivity in dealing with others or with difficult issues without causing offense.","She handled the criticism with great tact.","It takes tact to deliver bad news gently.","His tact during the meeting prevented an argument.","Tact is important when discussing sensitive topics.","She responded with tact to the rude question.","In business, tact can help maintain good relationships."
paradox,"a statement or situation that seems self-contradictory or absurd but may be true.","It's a paradox that the healthiest foods are sometimes the least appetizing.","The paradox of choice suggests more options can lead to less satisfaction.","He lived the paradox of being alone in a crowd.","The story's ending presented a fascinating paradox.","Paradoxically, silence can be louder than words.","The scientist explained the paradox in simple terms."
peculiar,"strange or odd; unusual.","He has a peculiar way of organizing his desk.","The house had a peculiar smell that lingered.","It's peculiar that she didn't answer the phone.","The artist's style is peculiar but intriguing.","Peculiar weather patterns affected the crops.","She noticed a peculiar expression on his face."
pinnacle,"the most successful point; the highest level or degree attainable.","Winning the award was the pinnacle of her career.","The climbers reached the pinnacle of the mountain at sunrise.","He is at the pinnacle of his profession.","The company achieved the pinnacle of success last year.","The novel represents the pinnacle of modern literature.","They celebrated reaching the pinnacle of their field."
cauldron,"a large metal pot used for cooking over an open fire; a situation characterized by instability or strong emotions.","The witches stirred a bubbling cauldron in the play.","The city was a cauldron of unrest during the protests.","She cooked the stew in a heavy cauldron over the fire.","The meeting became a cauldron of conflicting ideas.","War creates a cauldron of fear and uncertainty.","The market was a cauldron of excitement on opening day."
simmer,"to stay just below the boiling point while being heated; also, to be filled with suppressed anger or excitement.","Let the soup simmer for an hour to develop flavor.","Tensions continued to simmer beneath the surface.","Her excitement began to simmer as the event approached.","The issue has been simmering for months without resolution.","He tried to simmer down after the heated argument.","A simmering rivalry existed between the two artists."
nicety,"a fine or subtle detail, especially one that is part of polite social behavior.","He paid attention to every nicety of table manners.","The legal document included every nicety to avoid confusion.","She appreciated the niceties of formal conversation.","Understanding cultural niceties is important when traveling.","He missed the nicety of sending a thank-you note.","The chef explained the niceties of wine pairing."
prudent,"acting with or showing care and thought for the future; wise and cautious.","It is prudent to save money for emergencies.","She made a prudent investment in real estate.","Prudent planning prevented major losses.","He is prudent with his words in sensitive situations.","A prudent driver always wears a seatbelt.","They took prudent measures to ensure safety."
indirection,"the act of expressing something in a roundabout or indirect way.","He used indirection to avoid answering the question directly.","Indirection is common in diplomatic language.","She appreciated the indirection in his criticism—it was less harsh.","His indirection confused the audience.","The message was delivered with such indirection that few understood.","Indirection can sometimes obscure the true meaning."
conceive,"to form or devise (a plan or idea) in the mind; to imagine.","She conceived a plan for the new marketing campaign.","It is hard to conceive of life without technology.","He conceived the idea while on vacation.","They conceived a child after years of trying.","The architect conceived a bold new design.","It's difficult to conceive how the event happened."
interpose,"to place or insert between one thing and another; to intervene.","She tried to interpose herself between the arguing friends.","A mediator was interposed to resolve the dispute.","He interposed a question during the lecture.","The fence interposed a barrier between the two yards.","The lawyer interposed an objection in court.","Nature interposed obstacles to their progress."
notion,"a belief, idea, or opinion.","He rejected the notion that success comes without hard work.","She had a notion to start her own business.","The notion of time travel fascinates many.","He challenged the old-fashioned notions about education.","The notion that money buys happiness is debated.","She dismissed the notion as unrealistic."
relic,"an object surviving from an earlier time, especially one of historical or sentimental interest.","The museum displayed ancient relics from the Roman Empire.","Her grandmother's watch is a cherished relic.","The old church is a relic of medieval architecture.","He collected relics from World War II.","The artifact was a relic of a lost civilization.","Family traditions are living relics of the past."
asocial,"not enjoying or seeking the company of others; avoiding social interaction.","He was labeled asocial because he preferred solitude.","Asocial behavior can be mistaken for rudeness.","The asocial scientist worked late into the night alone.","Her asocial tendencies made group projects challenging.","He became increasingly asocial after moving cities.","Asocial animals are rarely seen in groups."
adept,"very skilled or proficient at something.","She is adept at solving complex problems.","He became adept at playing the guitar.","Adept negotiators can find common ground quickly.","The chef is adept in both French and Italian cuisine.","He is adept at using new technology.","Her adept handling of the crisis earned her praise."
taint,"to contaminate or pollute something; to affect with a bad or undesirable quality.","The scandal tainted the company's reputation.","The water supply was tainted by chemicals.","His comments tainted the friendly atmosphere.","She feared the mistake would taint her record.","Corruption can taint even the best intentions.","The food was tainted and had to be discarded."
virtue,"behavior showing high moral standards; a good or desirable quality.","Patience is considered a virtue.","She is admired for her virtue and honesty.","The program teaches the virtues of hard work.","Charity is a virtue celebrated by many cultures.","He believes in the virtue of self-discipline.","Virtue is often rewarded in the long run."
resent,"to feel bitter or angry about something, especially because you think it is unfair.","She began to resent the extra workload.","He resented being overlooked for the promotion.","Children may resent strict rules at home.","He resented the implication that he was lying.","She resented having to share her room.","They resented the new policies imposed by management."
bungler,"a person who does something clumsily or incompetently; a blunderer.","The project failed due to the efforts of a bungler.","He was known as a bungler in the kitchen after several cooking mishaps.","The bungler dropped the vase while cleaning.","They hired a professional after the bungler ruined the repairs.","Her attempts at DIY labeled her as a bungler among friends.","The bungler was quickly replaced on the team."
invariably,"always; without exception.","The sun rises invariably every morning.","He invariably forgets his keys at home.","Mistakes will invariably occur in any large project.","She is invariably polite to everyone she meets.","Traffic jams invariably happen during rush hour.","Their support for the cause is invariably strong."
feign,"to pretend to have a particular feeling, condition, or injury.","He tried to feign interest in the conversation.","She feigned illness to skip the meeting.","Actors often feign emotions on stage.","The child feigned sleep when his parents checked on him.","He feigned surprise at the news.","She could not feign enthusiasm for the boring task."
resolve,"to find a solution to a problem or difficulty; to decide firmly on a course of action.","They worked together to resolve the issue.","She resolved to improve her fitness this year.","The committee resolved the dispute quickly.","He resolved to save more money.","The conflict was resolved through negotiation.","She resolved never to make the same mistake again."
ripple,"a small wave or series of waves; a feeling or effect that spreads through a group or situation.","The news sent a ripple of excitement through the office.","She watched ripples form on the surface of the lake.","His comments caused a ripple of laughter in the room.","Economic changes create ripples throughout society.","A ripple of concern spread among the parents.","The pebble created ripples in the pond."
curb,"to restrain or keep in check; to control or limit something.","The government introduced new laws to curb pollution.","He struggled to curb his spending habits.","They curbed their enthusiasm to avoid disappointment.","Efforts to curb crime have intensified.","She took medicine to curb her appetite.","Curbing negative thoughts can improve well-being."
espouse,"to adopt or support a cause, belief, or way of life.","She espouses environmental protection in her daily life.","Many leaders espouse the values of equality and justice.","He espoused a vegan lifestyle after learning about animal welfare.","The organization espouses open communication.","They espouse the principles of fair trade.","He publicly espoused the new policy."
potent,"having great power, influence, or effect.","The medicine was potent and worked quickly.","Her words had a potent impact on the audience.","A potent argument changed the course of the debate.","The scent of the flower was surprisingly potent.","Potent emotions can drive people to action.","He brewed a potent cup of coffee."
malleable,"easily influenced or changed; able to be shaped or bent.","Gold is malleable and easy to shape into jewelry.","Children's minds are malleable and absorb information quickly.","The rules are malleable depending on the situation.","He appreciated her malleable attitude during negotiations.","The metal became malleable when heated.","Cultural norms are more malleable than we realize."
aesthetics,"the study of beauty, art, and taste; the appreciation of what is beautiful.","He studied aesthetics to better understand modern art.","The aesthetics of the building impressed the visitors.","Aesthetics influence the design of consumer products.","She has a keen sense of aesthetics in fashion.","Marketing uses aesthetics to attract customers.","The aesthetics of nature inspired her poetry."
impediment,"a hindrance or obstruction in doing something; something that makes progress difficult.","His injury was an impediment to playing sports.","Language can be an impediment to communication.","The heavy traffic was a major impediment to arriving on time.","Lack of funding acts as an impediment to research.","The new law removed several impediments to business growth.","Personal doubts can be a significant impediment to success."
amoral,"lacking a moral sense; not concerned with right or wrong.","The character in the novel acted in an amoral way.","He made decisions based on profit, remaining amoral to their effects.","Some animals are considered amoral, acting on instinct alone.","The amoral tone of the movie shocked some viewers.","She viewed the corporation's actions as amoral.","Amoral individuals may ignore societal rules."
consume,"to use up, eat, or drink; to completely destroy or absorb.","He can consume large amounts of information quickly.","The wildfire consumed thousands of acres.","She consumed her lunch in a hurry.","The new project consumed all his free time.","The virus consumed the computer's memory.","They consume electricity at a high rate."
disparate,"essentially different in kind; not allowing comparison.","The two cultures have disparate traditions.","Their skills are disparate but complementary.","Disparate opinions made consensus difficult.","The book covers disparate topics in each chapter.","She brings disparate viewpoints together in her work.","Disparate data sources were unified in the report."
renaissance,"a revival or renewed interest in something; originally, the period of great cultural change in Europe from the 14th to 17th centuries.","The city experienced a renaissance in arts and culture.","She studied the Renaissance period in college.","There is a renaissance of interest in vinyl records.","The neighborhood underwent a renaissance after new businesses opened.","The project sparked a renaissance in community spirit.","The Renaissance produced many influential artists."
distillation,"the process of purifying a liquid by heating and cooling; also, the extraction of the essential meaning or most important aspects of something.","The distillation of water removes impurities.","His speech was a distillation of years of research.","They learned about distillation in chemistry class.","The movie is a distillation of the novel's main themes.","Distillation is used to produce spirits like whiskey.","She presented a distillation of her findings at the conference."
premise,"a statement or idea that is accepted as true and that forms the basis for a theory or argument.","The premise of the movie intrigued audiences.","His argument was flawed because the premise was incorrect.","The business plan is based on the premise of rapid growth.","The story works from the premise that time travel is possible.","She questioned the premise of the research study.","The debate began with a shared premise."
definitive,"(of a conclusion or agreement) done or reached decisively and with authority; the most complete or reliable.","The committee reached a definitive decision.","She wrote the definitive guide to Italian cooking.","No definitive answer was given at the meeting.","The test results were definitive and left no doubt.","He wanted a definitive statement from the manager.","The biography is considered the definitive account of her life."
pertain,"to relate to or have a connection with something.","The laws pertain to all citizens regardless of status.","Questions pertaining to the topic are welcome.","The instructions pertain only to the advanced users.","The new policy does not pertain to part-time staff.","His research pertains to environmental issues.","Only comments pertaining to the agenda will be discussed."
pertinent,"relevant or applicable to a particular matter; appropriate.","She asked several pertinent questions during the interview.","The information is pertinent to our current project.","Only pertinent details should be included in the report.","He provided pertinent examples to support his claim.","Please keep your comments pertinent to the topic.","The manager highlighted the most pertinent issues."
foible,"a minor weakness or eccentricity in someone's character.","His forgetfulness is just a harmless foible.","They laughed about her foible of needing everything color-coded.","Everyone has a foible or two.","His foible never affected his work performance.","She found his foible endearing.","The comedian joked about people's everyday foibles."
frivolous,"not having any serious purpose or value; carefree and not serious.","They dismissed his complaint as frivolous.","She enjoyed buying frivolous accessories on vacation.","The lawsuit was thrown out for being frivolous.","He made a frivolous remark during the meeting.","Her frivolous attitude worried her parents.","The article criticized frivolous government spending."
abolish,"to formally put an end to (a system, practice, or institution).","The country voted to abolish capital punishment.","They worked to abolish outdated regulations.","The organization aims to abolish child labor worldwide.","The movement sought to abolish discrimination.","Parliament decided to abolish unnecessary taxes.","The law was abolished after years of protest."
inadvertently,"without intention; accidentally.","He inadvertently sent the email to the wrong person.","She inadvertently left her keys in the car.","The error was introduced inadvertently during editing.","He inadvertently offended his colleagues with his comment.","They inadvertently deleted important files.","The door was left open inadvertently."
precarious,"not securely held or in position; dangerously likely to fall or collapse; uncertain.","The ladder looked precarious against the wall.","Their financial situation was precarious after the job loss.","She crossed the precarious bridge with caution.","The political climate is precarious right now.","He lived in a precarious balance between work and family.","The precarious stack of books toppled over."
vagaries,"unexpected and inexplicable changes in a situation or in someone's behavior.","The vagaries of the weather ruined our picnic plans.","She was frustrated by the vagaries of the stock market.","The actor was known for the vagaries of his mood.","Travelers must adapt to the vagaries of flight schedules.","The vagaries of fortune can change lives overnight.","His plans were disrupted by the vagaries of fate."
vaunt,"to boast about or praise something, especially excessively.","He would vaunt his achievements at every opportunity.","The company vaunted its new technology in advertisements.","She vaunted her connections to influential people.","The resort vaunted its luxurious amenities online.","They vaunted their progress, but results were lacking.","The author vaunted his bestseller status."
notoriously,"famous or well known, typically for some bad quality or deed.","The restaurant is notoriously slow with service.","He is notoriously late to every meeting.","The road is notoriously dangerous at night.","That celebrity is notoriously difficult to interview.","She is notoriously strict with her students.","The city is notoriously expensive to live in."
vanity,"excessive pride in or admiration of one's own appearance or achievements.","His vanity was evident in his constant mirror checks.","She redecorated the house out of sheer vanity.","Vanity led him to overstate his accomplishments.","Her vanity prevented her from admitting mistakes.","The store sold products appealing to vanity.","He was criticized for his vanity in public speeches."
rancor,"bitterness or resentfulness, especially when long-standing.","Years of rancor existed between the two families.","She spoke with rancor about her former employer.","Rancor over the decision lingered for months.","Their negotiations were clouded by mutual rancor.","He tried to move past the rancor and forgive.","Political debates often reveal deep-seated rancor."
