word,word definition,Sentence 1,Sentence 2,Sentence 3,Sentence 4,Sentence 5,Sentence 6
gravitate,"to be drawn or attracted toward something or someone.","Many students gravitate toward science and technology fields.","She tends to gravitate to people who share her interests.","The crowd gravitated to the street performer.","He gravitated toward the snack table at the party.","Young professionals gravitate to big cities for work.","Children often gravitate toward fun activities."
gregarious,"sociable; enjoying the company of others.","He’s a gregarious host who loves throwing parties.","Her gregarious personality makes her popular at work.","Gregarious animals live in groups for protection.","She became more gregarious after joining the club.","The gregarious student quickly made new friends.","At family gatherings, he is always the most gregarious."
folly,"lack of good sense or judgment; foolishness.","Investing all your savings in one stock is folly.","He regretted the folly of his youth.","Ignoring expert advice can lead to folly.","The plan was dismissed as sheer folly by critics.","His folly cost the company thousands of dollars.","It would be folly to underestimate the competition."
malady,"a disease or disorder of the body or mind.","The malady spread quickly through the town.","Stress is often called the modern malady.","She suffered from a rare malady that puzzled doctors.","Economic malaise can be a social malady as well.","The doctor treated her malady with new medication.","Many maladies worsen without proper care."
mercenary,"a person primarily concerned with making money at the expense of ethics; or a professional soldier hired to serve in a foreign army.","He worked as a mercenary in various countries.","His mercenary attitude alienated his colleagues.","Mercenary soldiers fought for whoever paid them.","She was accused of being mercenary in her relationships.","The mercenary demanded payment before completing the job.","He was seen as a mercenary, caring only for profit."
condottiere,"a leader of a band of mercenary soldiers in Italy between the 14th and 16th centuries.","The condottiere led his troops into battle for the highest bidder.","History books detail the exploits of famous condottieri.","The city hired a condottiere for protection during the war.","Italian art often depicts the condottiere in armor.","The condottiere negotiated contracts with wealthy patrons.","His ambition was to become a renowned condottiere."
toil,"hard, continuous, and exhausting work.","Farmers toil in the fields from dawn to dusk.","Writing a novel is often a toil of love.","Years of toil finally paid off when she graduated.","Factory workers’ toil keeps the economy running.","He toiled over his research for months.","The garden flourished after much toil."
valiant,"possessing or showing courage or determination.","The valiant firefighters saved the family from the blaze.","She made a valiant effort to finish the marathon.","His valiant actions were recognized with a medal.","They put up a valiant fight despite the odds.","The dog made a valiant attempt to protect its owner.","She was valiant in standing up for her beliefs."
galore,"in plentiful or abundant amounts; in great quantities.","There were desserts galore at the party.","The festival had food and music galore.","Books galore filled the library shelves.","He found opportunities galore after moving to the city.","Spring brings flowers galore to the countryside.","Discounts galore await shoppers during the sale."
insinuate,"to suggest or hint at something, usually something negative, in an indirect way.","He tried to insinuate that she was responsible for the mistake.","The article insinuated corruption within the company.","She insinuated that he was lying without saying it directly.","His words insinuated doubt in the team’s abilities.","The politician insinuated that his opponent was dishonest.","Rumors insinuated themselves into the conversation."
aversion,"a strong feeling of dislike or opposition toward something.","She has an aversion to spicy food.","His aversion to crowds kept him at home.","Many people have an aversion to public speaking.","He expressed aversion towards unfair practices.","Her aversion to risk made her a cautious investor.","The dog showed aversion to loud noises."
antipathy,"a deep-seated feeling of dislike; aversion.","There was clear antipathy between the rival teams.","His antipathy for injustice drove him to protest.","She couldn’t hide her antipathy toward the proposal.","Antipathy developed after years of conflict.","He felt antipathy toward dishonest people.","Their antipathy made cooperation difficult."
conservative,"averse to change or innovation; favoring traditional views or values.","Her conservative views often clashed with her friends’ progressive ideas.","He wore conservative clothing to the interview.","The company took a conservative approach to investments.","Many voters prefer conservative policies in uncertain times.","Their conservative upbringing influenced their choices.","He gave a conservative estimate of the project’s cost."
finagle,"to obtain something by cunning, trickery, or dishonest means.","He managed to finagle an extra day off from work.","She finagled her way into the exclusive club.","They tried to finagle a better deal on the car.","He finagled tickets to the sold-out concert.","She finagled a last-minute extension on her assignment.","He was known to finagle favors from his colleagues."
edifice,"a large, imposing building; or a complex system of beliefs.","The ancient edifice towered over the city.","The cathedral is a magnificent edifice of stone.","He built an intellectual edifice around his theories.","The museum is housed in a grand edifice downtown.","The edifice was damaged during the earthquake.","Their beliefs formed an edifice of tradition."
hurl,"to throw something with great force.","He hurled the ball across the field.","Angry protesters hurled stones at the building.","She hurled her backpack onto the couch.","The comedian’s joke hurled the audience into laughter.","The child hurled his toy in frustration.","Waves hurled debris onto the shore."
intensive,"involving a lot of effort or activity in a short period of time.","She attended an intensive language course over the summer.","The patient required intensive care after surgery.","The company launched an intensive marketing campaign.","He completed an intensive workout at the gym.","An intensive search was conducted for the missing hiker.","They underwent intensive negotiations before the agreement."
extensive,"covering a large area; having a wide range or scope.","The storm caused extensive damage to the town.","She has extensive experience in the field.","The library holds an extensive collection of rare books.","The investigation was extensive and thorough.","He traveled extensively during his career.","Their research was extensive in scope."
sullen,"bad-tempered and sulky; unwilling to smile or be sociable.","He sat in sullen silence after the argument.","Her sullen expression worried her friends.","The child grew sullen when denied dessert.","A sullen sky signaled the coming storm.","His sullen attitude made teamwork difficult.","She remained sullen throughout the meeting."
glower,"to have an angry or sullen facial expression; to scowl.","He glowered at the noisy neighbors.","She glowered when her idea was dismissed.","The teacher glowered at the late students.","His glower made everyone uncomfortable.","The cat glowered from the corner of the room.","They glowered at each other during the dispute."
scowl,"to frown in an angry or bad-tempered way.","She scowled at the mess in the kitchen.","He scowled when asked to work late.","The coach scowled at the team after the loss.","A scowl crossed her face at the rude comment.","He scowled, but said nothing.","She tried to hide her scowl during the meeting."
sag,"to sink, droop, or settle downward from pressure or lack of strength.","The old mattress sagged in the middle.","Her spirits sagged after hearing the bad news.","The roof began to sag under the weight of snow.","He noticed his energy sag throughout the day.","The couch sagged from years of use.","The balloon sagged as the air escaped."
charlatan,"a person falsely claiming to have special knowledge or skills; a fraud.","The charlatan promised miracle cures to desperate patients.","He was exposed as a charlatan by investigative reporters.","Many charlatans exploit people’s trust for profit.","The seminar turned out to be led by a charlatan.","She warned her friends about online charlatans.","The charlatan’s scheme eventually failed."
retinue,"a group of assistants, advisers, or followers accompanying an important person.","The celebrity arrived with a large retinue.","The king’s retinue followed him everywhere.","She traveled with a retinue of bodyguards.","The politician’s retinue organized the event.","His retinue handled all the travel arrangements.","The CEO’s retinue included several advisors."
cynical,"distrustful of human sincerity or goodness; believing people are motivated by self-interest.","He gave a cynical laugh at the politician’s promises.","Her cynical view makes her skeptical of compliments.","Many people are cynical about corporate motives.","His cynical comments ruined the mood.","She became cynical after repeated disappointments.","The movie offers a cynical take on modern society."
brazenly,"in a bold and shameless way; without attempt to hide.","She brazenly lied about her whereabouts.","The company brazenly ignored the law.","He brazenly flaunted the rules at work.","They brazenly took credit for others’ work.","The student brazenly cheated on the test.","He brazenly interrupted the meeting."
inconsequential,"not important or significant; trivial.","The error was inconsequential and easily fixed.","Her concerns seemed inconsequential in the grand scheme.","He dismissed the issue as inconsequential.","The cost is inconsequential compared to the benefits.","They argued over inconsequential details.","The delay was deemed inconsequential."
relinquish,"to voluntarily give up or surrender something.","She decided to relinquish control of the project.","He relinquished his claim to the inheritance.","The company had to relinquish its market share.","They relinquished their seats to the elderly passengers.","She refused to relinquish her dreams.","He relinquished his position after the scandal."
machiavellian,"cunning, scheming, and unscrupulous, especially in politics or in advancing one's career.","His Machiavellian tactics secured him the promotion.","The politician was known for her Machiavellian strategies.","Machiavellian behavior is frowned upon in teamwork.","He admired her Machiavellian approach to negotiation.","The novel features a Machiavellian villain.","Her Machiavellian maneuvers shocked her colleagues."
unscrupulous,"showing no moral principles; dishonest or unfair.","The unscrupulous dealer sold fake antiques.","Unscrupulous companies exploit their workers.","He was fired for unscrupulous business practices.","She avoided unscrupulous lenders at all costs.","Unscrupulous journalists spread false stories.","The offer sounded unscrupulous and risky."
guile,"sly or cunning intelligence; the use of clever but dishonest methods to deceive.","She used her guile to negotiate a better contract.","The fox is a symbol of guile in many tales.","He achieved his goals through guile, not force.","Her guile in the interview impressed the panel.","Guile is often necessary in competitive environments.","He relied on guile to survive in the city."
quintessence,"the most perfect or typical example of a quality or class.","She is the quintessence of grace under pressure.","The car was the quintessence of luxury and comfort.","His kindness is the quintessence of good character.","The novel is considered the quintessence of the genre.","Their home is the quintessence of modern design.","He represents the quintessence of dedication."
poised,"having a calm, confident, and self-assured manner, especially in difficult situations.","She remained poised during the crisis.","The speaker was poised and articulate.","He handled the challenge with poised confidence.","The gymnast was poised before her routine.","Poised leadership is valued in emergencies.","She appeared poised despite the chaos."
intercede,"to intervene or mediate on behalf of another person, especially to resolve a dispute.","She asked her friend to intercede in the argument.","The teacher interceded to stop the fight.","He tried to intercede on behalf of the accused.","Her lawyer interceded with the authorities.","They interceded to prevent further conflict.","He interceded to help the struggling student."
clemency,"mercy or leniency shown towards someone who could be punished harshly.","The judge granted clemency to the young offender.","He pleaded for clemency after the verdict.","The governor’s clemency saved her from execution.","She was known for her clemency toward first-time offenders.","Clemency was requested by the prisoner’s family.","The president issued a clemency order."
dire,"extremely serious or urgent, often involving danger or disaster.","The country is in dire need of medical supplies.","He warned of dire consequences if action was not taken.","They faced dire conditions after the storm.","Her finances were in a dire state.","There were dire predictions about the economy.","The refugees were in dire circumstances."
pre-eminent,"surpassing all others; very distinguished in a particular field.","She is a pre-eminent expert in neuroscience.","The pre-eminent team dominated the tournament.","He became pre-eminent in his profession.","The pre-eminent artist’s work is displayed worldwide.","The university is pre-eminent in research.","His pre-eminent reputation attracted many students."
rhetoric,"the art of effective or persuasive speaking or writing, often using figures of speech and other compositional techniques.","Political rhetoric often appeals to emotions.","She studied rhetoric to improve her public speaking.","The candidate’s rhetoric was criticized as empty.","Good rhetoric can influence public opinion.","He admired the rhetoric of ancient philosophers.","The debate was full of passionate rhetoric."
pragmatic,"dealing with problems or situations in a practical and sensible way rather than relying on theory or idealism.","She offered a pragmatic solution to the issue.","His pragmatic approach saved time and resources.","The company values pragmatic decision-making.","He’s known for his pragmatic leadership style.","Pragmatic policies help address real-world problems.","They took a pragmatic view of the situation."
aggrandize,"to increase the power, status, wealth, or reputation of something or someone, often to an excessive degree.","He sought to aggrandize himself at every opportunity.","The emperor aggrandized his family through marriage alliances.","The CEO aggrandized the company with bold acquisitions.","They accused her of trying to aggrandize her achievements.","The monument was built to aggrandize the dynasty.","He aggrandized his role in the project."
proselytize,"to try to convert someone to a different religion, belief, or opinion.","They tried to proselytize their neighbors about their faith.","He proselytized at every opportunity, sharing his views.","Companies sometimes proselytize new employees with their values.","She avoided friends who tried to proselytize her.","Proselytizing is frowned upon in some workplaces.","The group proselytized on street corners."
uncanny,"strange or mysterious, especially in an unsettling way.","She has an uncanny ability to predict the weather.","The twins had an uncanny resemblance.","His memory for details is uncanny.","There was an uncanny silence in the room.","The coincidence was uncanny and hard to explain.","He felt an uncanny sense of déjà vu."
magnate,"a wealthy and influential person, especially in business.","He became a real estate magnate by age thirty.","The media magnate owns several newspapers.","She is a magnate in the tech industry.","The oil magnate funded the project.","Magnates often influence political decisions.","The shipping magnate expanded his empire globally."
clairvoyant,"a person who claims to have the ability to see events in the future or beyond normal sensory contact.","The clairvoyant predicted the winning lottery numbers.","She visited a clairvoyant for advice about her future.","He claimed to have clairvoyant visions during meditation.","The police consulted a clairvoyant in a missing persons case.","Many people are skeptical of clairvoyants.","Clairvoyant abilities are popular in fiction."
insinuation,"an indirect or subtle suggestion, typically of something unpleasant or discreditable.","She resented the insinuation that she was dishonest.","The article made insinuations about the company’s finances.","His speech was full of subtle insinuations.","He denied any insinuation of wrongdoing.","Insinuations can damage reputations even without proof.","Their insinuations caused tension in the office."
coaxing,"gently persuading someone to do something by using flattery or persistent effort.","With a bit of coaxing, the shy child joined the game.","She used coaxing to get him to try the new dish.","Coaxing the cat out from under the bed took hours.","The manager succeeded through gentle coaxing, not force.","His coaxing finally convinced her to attend the event.","A little coaxing helped them reach an agreement."
cajole,"to persuade someone to do something through repeated coaxing or flattery.","She tried to cajole her friend into going to the party.","He cajoled his boss into giving him an extension.","The children cajoled their parents into buying ice cream.","It took some cajoling to get him on stage.","They cajoled the committee into approving the plan.","She cajoled her way into the exclusive event."
vehement,"showing strong, forceful, and passionate feelings.","He gave a vehement denial of the accusations.","Her speech was delivered with vehement conviction.","The protesters voiced their opinions vehemently.","He was a vehement opponent of the policy.","Vehement debates erupted in parliament.","She expressed her views in a vehement letter."
incredulity,"the state of being unable or unwilling to believe something; disbelief.","She stared in incredulity at the lottery ticket.","There was incredulity in his voice after hearing the news.","The announcement was met with incredulity by the staff.","He reacted with incredulity to the unexpected offer.","Her incredulity was clear from her expression.","The story was so strange it provoked incredulity."
innocuous,"not harmful or offensive; unlikely to cause injury or offense.","His joke was innocuous, but she still took offense.","The medicine is innocuous and safe for children.","Most of the emails were innocuous and easily ignored.","Their conversation was innocuous, about the weather.","She made an innocuous comment about the food.","The insect bite was innocuous and quickly healed."
aloof,"not friendly or forthcoming; distant and reserved.","He remained aloof during the entire meeting.","Her aloof demeanor made her seem unapproachable.","The cat stayed aloof from strangers.","She appeared aloof, but was actually shy.","He was criticized for being aloof at social events.","Despite his fame, he stayed aloof from the media."
embers,"small, glowing pieces of coal or wood in a dying fire.","The campfire’s embers glowed in the darkness.","He watched the embers slowly fade as the night grew colder.","She poked at the embers with a stick.","The last embers of the fire warmed their hands.","Smoke rose from the embers of the burned house.","They roasted marshmallows over the glowing embers."
bout,"a short period of intense activity of a specified kind.","He suffered a bout of flu last winter.","After a bout of laughter, the group quieted down.","She had a brief bout of homesickness.","A bout of rain delayed the game.","He experienced a bout of insomnia before exams.","After a bout of cleaning, the house sparkled."
scoundrel,"a dishonest or unscrupulous person.","The scoundrel cheated his partners and fled.","She called him a scoundrel after the betrayal.","History is full of tales about famous scoundrels.","The movie’s villain was a charming scoundrel.","He played the scoundrel in the school play.","She avoided scoundrels in her business dealings."
wily,"skilled at gaining an advantage, especially through deceit or cleverness.","The wily fox escaped the hunters.","She developed a wily strategy to win the game.","He’s a wily negotiator, always getting the best deal.","The wily thief avoided capture for years.","They admired his wily approach to problem-solving.","The wily politician outmaneuvered his rivals."
effusive,"expressing feelings of gratitude, pleasure, or approval in an unrestrained or heartfelt manner.","Her effusive thanks embarrassed the host.","He gave an effusive welcome to his old friend.","The teacher’s effusive praise motivated the students.","Effusive applause filled the theater after the performance.","His effusive nature made him popular at parties.","She wrote an effusive letter of recommendation."
vie,"to compete eagerly with others in order to achieve something.","Several candidates vied for the position.","Teams vied for first place in the tournament.","She vied with her peers for the scholarship.","The restaurants vied for customers on the busy street.","He vied for attention at the meeting.","Many companies vie for market dominance."
whim,"a sudden or impulsive desire or change of mind, especially one that is unusual or unexplained.","On a whim, they decided to drive to the coast.","She bought the dress on a whim.","His travel plans often change on a whim.","They left the party on a whim and went dancing.","He followed his whim and tried skydiving.","The decision was made on a whim."
fawn,"to give someone excessive flattery or attention in order to gain favor; to behave obsequiously.","She fawned over her boss to get a promotion.","The waiter fawned over the celebrity guests.","He disliked people who fawned for approval.","Fans fawned over the singer after the concert.","She refused to fawn on those in power.","His fawning attitude annoyed his colleagues."
smother,"to kill someone by covering their nose and mouth to prevent breathing; to suffocate.","He tried to smother the fire with a blanket.","She nearly smothered her child with affection.","The thick smoke threatened to smother the house.","He felt smothered by the crowded room.","The flowers were smothered by weeds in the garden.","The scandal smothered his political career."
tenet,"a principle, belief, or doctrine that is generally held to be true, especially by a group or organization.","Freedom of speech is a central tenet of democracy.","The tenets of the religion are taught from childhood.","Honesty is an important tenet in their family.","The company operates on the tenet of customer satisfaction.","Equality is a tenet of their philosophy.","The scientist questioned some established tenets."
axiom,"a statement or proposition that is regarded as being established, accepted, or self-evidently true.","The axiom 'actions speak louder than words' is often quoted.","In mathematics, an axiom is a starting point for reasoning.","She lived by the axiom that hard work pays off.","The axiom was accepted without question in the group.","It’s an axiom that all people deserve respect.","He challenged the old axioms of the industry."
codify,"to arrange laws, rules, or principles into a systematic and organized code or system.","The new government moved to codify existing regulations.","They codified their policies in an employee handbook.","Scholars worked to codify ancient customs into law.","The committee codified safety procedures for the lab.","The constitution codified citizens' rights.","She helped codify the school’s dress code."
caress,"to touch or stroke gently and lovingly.","She caressed the baby’s cheek softly.","He caressed her hair as they watched the sunset.","The cat caressed her leg with its tail.","A warm breeze caressed his face.","She caressed the fabric, admiring its texture.","The artist caressed the canvas with delicate brushstrokes."
acclimatize,"to become accustomed or adapted to a new climate, environment, or situation.","It took him weeks to acclimatize to the mountain altitude.","They acclimatized to city life after moving from a rural town.","Travelers must acclimatize to new time zones.","The plant acclimatized quickly to the greenhouse.","Athletes acclimatize before competing abroad.","She struggled to acclimatize to her new job."
abysmal,"extremely bad; appalling.","The service at the restaurant was abysmal.","He received abysmal grades on his report card.","Living conditions in the camp were abysmal.","The team’s performance was abysmal this season.","Customer reviews described the product as abysmal.","She was shocked by the abysmal state of the roads."
penance,"voluntary self-punishment or an act showing repentance for wrongdoing, especially as a religious duty.","He did community service as penance for his crime.","She saw fasting as a form of penance.","The priest gave her penance after confession.","Charity work was his penance for past mistakes.","He walked miles as penance for his harsh words.","Writing an apology letter was her penance."
benevolence,"kindness and a desire to do good for others; goodwill.","Her benevolence inspired her to volunteer every weekend.","He showed benevolence by donating to the shelter.","Benevolence is valued in many cultures.","The organization was founded on benevolence.","A simple act of benevolence can change someone’s day.","His benevolence extended to his employees."
