1,vigilance,more careful attention,monday,2025-05-05,2025-05-05
2,ostensibly,apparently or purportedly,monday,2025-05-05,2025-05-05
3,elegance,quality of being graceful and attractive in appearance,monday,2025-05-05,2025-05-05
4,trudge,to walk slowly with a lot of effort,monday,2025-05-05,2025-05-05
5,marginalize,"treat as not important, as insignificant",monday,2025-05-05,2025-05-05
6,elaborate,a complicated setup,monday,2025-05-05,2025-05-05
7,folly,the fact of being stupid,monday,2025-05-05,2025-05-05
8,celibacy,abstainance from sexual intercourse,monday,2025-05-05,2025-05-05
9,ostensible,"stated or appearing to be true, but not necessarily so",monday,2025-05-05,2025-05-05
10,nay,to introduce a second wordto emphaize more on it,monday,2025-05-05,2025-05-05
11,aesthetics,study of the principle of art and of beauty,monday,2025-05-05,2025-05-05
12,stodgy,dull and uninspired,monday,2025-05-05,2025-05-05
13,retinue,"a group of advisers, assitants or an aristocrat escort",monday,2025-05-05,2025-05-05
14,inconspicuous,"not easily or quickly noticed or seen, nuance",monday,2025-05-05,2025-05-05
15,prig,a self-righteously moralistic person who behaves better than others,monday,2025-05-05,2025-05-05
16,plagiarize,to use another persons works and pretend its yours,monday,2025-05-05,2025-05-05
17,prestigious,"inspiring respect and admiration, having high status",monday,2025-05-05,2025-05-05
18,incredulity,the state of being unwilling to believe something,monday,2025-05-05,2025-05-05
19,unfathomable,"impossible to understand, enigma, unscrutable",monday,2025-05-05,2025-05-05
20,adept,having a natural ability to do something that needs skills,monday,2025-05-05,2025-05-05
