word,word definition,Sentence 1,Sentence 2,Sentence 3,Sentence 4,Sentence 5,Sentence 6
stale,"no longer fresh or new; lacking in originality or effectiveness.","The bread was stale by the next morning.","Her jokes became stale after years of repetition.","The air in the room felt stale and heavy.","Stale ideas failed to inspire the team.","He replaced the stale coffee with a fresh pot.","Stale relationships can drain energy."
convoluted,"extremely complex, intricate, or difficult to follow.","The plot of the novel was convoluted.","His explanation was so convoluted that few understood it.","She struggled to follow the convoluted instructions.","Legal documents are often convoluted and confusing.","The conspiracy theory was convoluted and far-fetched.","Convoluted bureaucracy delayed the project."
disavow,"to deny responsibility for or connection with something; to reject.","The politician disavowed any knowledge of the scandal.","He publicly disavowed his former friend's actions.","The company disavowed liability for the product defect.","She disavowed her previous statements.","They disavowed involvement in the incident.","He was quick to disavow rumors about his resignation."
ostracism,"exclusion from a society, group, or social acceptance.","The student suffered ostracism after the incident.","Ostracism can have lasting psychological effects.","He felt the sting of ostracism from his peers.","The club practiced ostracism against rule-breakers.","Social ostracism isolated her from the community.","Ostracism was used as punishment in ancient Greece."
derogatory,"showing a critical, disrespectful, or disparaging attitude.","He made derogatory remarks about his coworkers.","The article contained derogatory language.","Derogatory comments are not tolerated in the workplace.","She received a derogatory nickname in school.","The film was criticized for its derogatory portrayal of women.","His derogatory attitude cost him friends."
assiduous,"showing great care, attention, and perseverance.","Her assiduous efforts led to a promotion.","He was assiduous in keeping accurate records.","Assiduous study improved her grades.","The gardener was assiduous with the roses.","Assiduous attention to detail is key in surgery.","They were assiduous in their search for solutions."
ferret,"to search for something persistently and thoroughly.","She ferreted out the missing documents.","The journalist ferreted for the truth in the story.","He ferreted through old records for clues.","The detective ferreted out the suspect's hiding place.","It took weeks to ferret out the source of the leak.","She ferreted in the drawers for her keys."
dissimulation,"the act of hiding one's thoughts, feelings, or character; pretense.","His dissimulation fooled everyone at the party.","She became skilled at dissimulation in corporate politics.","Dissimulation can protect one's privacy.","He regretted resorting to dissimulation during negotiations.","Her dissimulation masked her true intentions.","He practiced dissimulation to avoid confrontation."
belligerently,"in a hostile, aggressive, or warlike manner.","He spoke belligerently during the debate.","The crowd shouted belligerently at the referee.","Belligerently waving their flags, the protesters marched.","She responded belligerently to criticism.","The two nations acted belligerently toward each other.","He entered the meeting belligerently, ready for a fight."
tirade,"a long, angry, and critical speech.","Her boss launched into a tirade about missed deadlines.","He delivered a tirade against government corruption.","The teacher's tirade startled the class.","After the mistake, she faced a tirade from her coach.","His tirade lasted nearly half an hour.","The politician unleashed a tirade at the rally."
goad,"to provoke or annoy someone so as to stimulate a reaction.","He tried to goad his friend into joining the contest.","The children goaded the cat with a string.","She was goaded into responding to the insult.","Protesters goaded the officials with chants.","He goaded his opponent by mocking him.","The media goaded the celebrity with intrusive questions."
invective,"insulting, abusive, or highly critical language.","The online forum was filled with invective.","He responded to criticism with a stream of invective.","Political debates often descend into invective.","She was shocked by the invective in his letter.","The comedian's invective offended some audience members.","Invective rarely leads to productive discussion."
petulance,"the quality of being childishly sulky, irritable, or easily annoyed.","His petulance was evident when he didn't get his way.","She displayed petulance over the minor inconvenience.","Children's petulance can test a parent's patience.","He apologized for his outburst of petulance.","Her petulance made collaboration difficult.","Petulance is not tolerated in a professional setting."
shabby,"in poor condition through long use or lack of care.","The apartment was clean but shabby.","He wore a shabby coat in the cold weather.","The hotel's shabby appearance deterred guests.","Shabby furniture filled the old house.","The book's shabby cover showed years of use.","She felt embarrassed by her shabby shoes."
vicious,"deliberately cruel, violent, or dangerous.","The dog became vicious when provoked.","He made a vicious attack on his opponent's character.","A vicious rumor spread through the office.","The criminal's actions were described as vicious.","Vicious competition led to unethical behavior.","She endured vicious bullying at school."
insatiable,"impossible to satisfy; always wanting more.","He had an insatiable appetite for knowledge.","Her insatiable curiosity led her all over the world.","The company's insatiable demand for profits drove expansion.","She possessed an insatiable hunger for adventure.","Insatiable ambition can be both a blessing and a curse.","His insatiable desire for recognition was exhausting."
implausible,not seeming reasonable or probable; difficult to believe.,"The idea that he finished the marathon in under two hours seemed implausible to everyone.","Her excuse for missing the meeting was so implausible that her boss raised an eyebrow.","It is implausible to think that aliens built the pyramids.","The witness gave an implausible story that contradicted all other evidence.","Some movie plots are so implausible, they make you laugh rather than feel suspense.","The scientist dismissed the theory as implausible without concrete evidence."
resplendent,"shining brilliantly; very bright, attractive, or impressive in appearance.","The bride looked resplendent in her white gown under the shimmering lights.","The garden was resplendent with colorful spring flowers.","The palace interior was resplendent with gold and crystal chandeliers.","He wore a resplendent uniform adorned with medals for the ceremony.","The resplendent sunset cast brilliant colors across the sky.","During the festival, the city square was resplendent with decorations and lights."
emaciated,extremely thin and weak, often due to illness or lack of food.,"After weeks of illness, the dog appeared emaciated and frail.","The emaciated refugee received urgent medical care upon arrival.","His face was gaunt and emaciated after months of inadequate nutrition.","The rescue team found several emaciated cattle abandoned on the farm.","Her emaciated figure was a stark reminder of the famine's severity.","Doctors worked tirelessly to rehabilitate the emaciated children."
litigation,the process of taking legal action; resolving disputes in court.,"The company faced years of litigation over patent rights.","Litigation can be costly and time-consuming for both parties involved.","He avoided litigation by settling the dispute out of court.","The threat of litigation forced the contractor to honor the agreement.","Environmental groups initiated litigation to stop the construction.","Litigation over the inheritance divided the family for years."
contortion,a twisted or bent condition, shape, or form.,"The gymnast's contortion left the audience in awe.","His face twisted in a contortion of pain as he sprained his ankle.","The sculpture was a strange contortion of metal and glass.","She managed to fit into the suitcase through impressive contortion.","The accident left the car in a contortion barely recognizable as a vehicle.","Yoga practitioners sometimes achieve poses of amazing contortion."
alienated,feeling isolated or estranged from others or from a group.,"He felt alienated from his colleagues after the promotion.","Her unusual hobbies sometimes made her feel alienated at school.","Remote work left many employees feeling alienated from the team.","Language barriers can cause immigrants to feel alienated in a new country.","After the argument, he became alienated from his closest friends.","The new policy alienated many long-time customers."
consummate,"showing a high degree of skill or perfection; highly accomplished.","She is a consummate professional who delivers quality work every time.","The chef prepared a meal with consummate skill and creativity.","He played the violin with a consummate artistry that wowed the audience.","As a negotiator, he was a consummate diplomat, always calm and composed.","The actor gave a consummate performance in the leading role.","Her consummate attention to detail sets her apart from her peers."
regaling,"entertaining or amusing someone, often with food, drink, or stories.","He spent the evening regaling his friends with tales of his travels.","Grandma was regaling the children with stories from her youth.","They regaled their guests with a feast and lively conversation.","The comedian was regaling the crowd with hilarious anecdotes.","She regaled us with stories of her adventures abroad.","He regaled his colleagues at lunch with his witty observations."
servility,an excessive willingness to serve or please others; submissiveness.,"His servility toward his boss was obvious and sometimes embarrassing.","She disliked the servility expected of employees in the old-fashioned company.","The dog's servility was evident as it waited for commands.","He spoke with such servility, it was clear he feared authority.","The leader demanded servility from his followers, punishing any sign of independence.","Her servility made her susceptible to being taken advantage of."
requite,to return a favor, service, or feeling.,"She hoped to requite his kindness with a thoughtful gift.","He was determined to requite her support with unwavering loyalty.","It is difficult to requite such generosity with mere words.","The country promised to requite the aid received during the disaster.","He tried to requite her love, but his feelings had changed.","She always remembered to requite a favor, no matter how small."
ignoramus,an ignorant or uneducated person.,"He was dismissed as an ignoramus for his lack of basic knowledge.","Don't let that ignoramus convince you with his wild theories.","The professor refused to argue with an ignoramus on scientific matters.","She called her opponent an ignoramus during the heated debate.","An ignoramus spread misinformation on the online forum.","Despite being called an ignoramus, he sought to educate himself."
reproach,to express disapproval, disappointment, or criticism.,"Her mother looked at her with reproach after the careless mistake.","He spoke with gentle reproach about her missed deadlines.","The coach's reproach motivated the team to train harder.","She felt the silent reproach of her friends for leaving early.","His actions brought public reproach upon the organization.","The principal did not hesitate to reproach the students for cheating."
remonstrate,to make a forceful or earnest protest or objection.,"Citizens gathered to remonstrate against the new law.","He remonstrated with his boss about the unfair treatment.","Parents remonstrated at the school board meeting over the curriculum changes.","She remonstrated loudly, insisting on her innocence.","Activists remonstrated outside the factory gates.","The employee remonstrated when his vacation request was denied."
vice,immoral or wicked behavior; a bad habit.,"Gambling became his vice after he lost his job.","Smoking is a vice that is hard to break for many people.","He struggled to overcome the vices of his youth.","Corruption is a vice that undermines societies.","She viewed gossiping as a minor vice.","The novel explored the contrast between virtue and vice."
facile,"appearing neat and comprehensive only by ignoring the true complexities of an issue; superficial.","His facile explanation failed to address the real problems.","She gave a facile answer that sounded good but lacked substance.","The article offered a facile analysis of a complex situation.","The politician's facile promises were quickly forgotten.","It's easy to make facile judgments without understanding all the facts.","His facile charm masked deep insecurities."
reinvigorate,to give new energy, strength, or life to something or someone.,"A walk in the fresh air helped reinvigorate her spirits.","The CEO launched new initiatives to reinvigorate the company.","The exercise routine was designed to reinvigorate tired muscles.","He hoped a vacation would reinvigorate his creativity.","The community program aimed to reinvigorate the neighborhood.","Changing careers can sometimes reinvigorate your sense of purpose."
debauchery,"excessive indulgence in sensual pleasures, especially involving sex, alcohol, or drugs.","The novel depicted a world of wealth and debauchery.","The party was notorious for its debauchery and wild behavior.","He lost his fortune to gambling and debauchery.","The film criticized the debauchery of the elite class.","Years of debauchery took a toll on his health.","They were arrested after a weekend of debauchery at the club."
inertia,a tendency to remain unchanged or do nothing; resistance to change or motion.,"Corporate inertia slowed the adoption of new technology.","He fought his own inertia to start exercising again.","Social inertia kept old traditions alive in the community.","The inertia of the heavy object made it difficult to move.","Political inertia prevented the passing of important reforms.","She overcame inertia with a burst of motivation."
denigrate,"to unfairly criticize or belittle someone or something.","He was quick to denigrate his competitors in public.","It's wrong to denigrate someone's achievements out of jealousy.","The critics denigrated the artist's new work.","Social media can be used to denigrate people anonymously.","His constant denigrating remarks affected her confidence.","They denigrated the proposal without offering alternatives."
elude,"to escape from or avoid something or someone, typically in a skillful or cunning way.","The suspect managed to elude the police for weeks.","Success seemed to elude him despite his efforts.","She tried to remember the answer, but it continued to elude her.","The true meaning of the poem eluded many readers.","Sleep eluded him during the stressful period.","Wild animals often elude capture by hiding."
pugnacity,a natural disposition to be aggressive or eager to fight or argue.,"His pugnacity got him into frequent arguments at work.","The boxer's pugnacity was evident even outside the ring.","Her pugnacity made her an effective, if sometimes abrasive, leader.","Debates were lively thanks to his pugnacious attitude.","Pugnacity can be a liability in diplomatic negotiations.","His pugnacity alienated colleagues who preferred calm discussion."
rudimentary,"involving only basic principles; elementary or undeveloped.","She had only a rudimentary understanding of French.","The tools available in the workshop were rudimentary.","Children are taught rudimentary math in kindergarten.","The village had rudimentary medical facilities.","The instructions provided were rudimentary at best.","His drawing skills were still quite rudimentary."
crudity,"the quality of being rudimentary, coarse, or lacking refinement.","The crudity of his manners shocked the guests.","The sketch was charming in its crudity and simplicity.","She apologized for the crudity of her language during the argument.","The film was criticized for its crudity and lack of polish.","The meal, though filling, was marked by a certain crudity.","The crudity of the construction was obvious to any observer."
odyssey,"a long, adventurous journey or experience.","His career has been an odyssey of growth and learning.","The couple's odyssey across Asia lasted a full year.","Writing the novel was a creative odyssey for her.","Their odyssey through the legal system was exhausting.","The young man's odyssey took him through countless jobs and cities.","The documentary follows the odyssey of a migrant family."
surmise,to suppose something is true without having evidence to confirm it.,"I can only surmise that she missed the train.","The detective surmised that the crime happened at night.","He surmised from her silence that she was upset.","We surmise that the project will be delayed due to weather.","She surmised that he was lying based on his expression.","Without data, scientists can only surmise the cause of the phenomenon."
presumptuous,failing to observe the limits of what is permitted or appropriate; overconfident.,"It was presumptuous of him to assume he would be invited.","She made a presumptuous request for a raise on her first day.","Don't be presumptuous and speak for the entire group.","His presumptuous attitude irritated his colleagues.","The presumptuous question caught everyone off guard.","He apologized for being presumptuous in making suggestions."
ambivalent,having mixed or contradictory feelings about something or someone.,"She felt ambivalent about moving to a new city for work.","His ambivalent response made it hard to know what he wanted.","Many people are ambivalent about the use of social media.","He was ambivalent towards the promotion, unsure if he wanted it.","Her ambivalent feelings about marriage were confusing.","They expressed ambivalence about the policy changes."
austerity,"extreme plainness and simplicity; strict economic measures to reduce spending.","The government imposed austerity measures to cut the deficit.","The room's austerity was softened by a single vase of flowers.","During austerity, families learned to live with less.","Austerity policies sparked protests across the country.","She admired the austerity of the minimalist design.","Economic austerity affected public services."
sternness,the quality of being serious, strict, or severe.,"The teacher's sternness kept the class disciplined.","His father's sternness was intimidating but fair.","The judge's sternness was evident in her sentencing.","There was a sternness in her voice that brooked no argument.","The manager's sternness discouraged late arrivals.","Sternness is sometimes necessary to enforce rules."
plenitude,an abundance or large amount of something.,"The harvest brought a plenitude of fresh vegetables.","There was a plenitude of options on the restaurant menu.","She experienced a plenitude of joy at the wedding.","The plenitude of evidence convinced the jury.","His library contains a plenitude of rare books.","The plenitude of resources made the project possible."
prosperity,the state of being successful, especially financially.,"The country enjoyed years of peace and prosperity.","Education is often linked to personal prosperity.","They worked hard to achieve prosperity for their family.","Economic prosperity led to improved living standards.","His investments brought him prosperity in retirement.","The company celebrated a decade of prosperity."
cohesion,"the action or fact of forming a united, integrated whole.","Team cohesion improved after the retreat.","The glue provided cohesion between the two surfaces.","Cultural festivals promote cohesion in diverse communities.","The project's success depended on group cohesion.","Their cohesion as a band made their music strong.","Social cohesion is vital for a peaceful society."
dissension,disagreement that leads to discord within a group.,"There was dissension among the committee members.","The coach struggled to manage dissension on the team.","Political dissension threatened to split the party.","Dissension in the workplace can lower morale.","The proposal caused dissension within the organization.","They tried to resolve their dissension through dialogue."
discord,lack of agreement or harmony between people.,"Years of discord tore the family apart.","Political discord can destabilize governments.","The discord in the band led to their breakup.","Discord between neighbors made the street tense.","Religious discord has sparked many conflicts in history.","Her efforts to mediate the discord were unsuccessful."
ostracise,to exclude someone from a society or group.,"The group decided to ostracise him for breaking their trust.","She felt ostracised by her classmates after the rumor spread.","Communities sometimes ostracise those who are different.","Employees feared being ostracised if they spoke up.","He was ostracised from the club for cheating.","Ostracising others can lead to loneliness and resentment."
overweening,showing excessive confidence, pride, or arrogance.,"His overweening ambition alienated his friends.","The CEO's overweening pride led to risky decisions.","She displayed overweening confidence despite little experience.","Overweening arrogance is often punished by failure.","His overweening belief in his abilities was unfounded.","The overweening tone of the speech was off-putting."
incessant,continuing without interruption; unceasing.,"The incessant noise from traffic made it hard to sleep.","She was annoyed by his incessant questioning.","Incessant rain flooded the streets.","The baby's incessant crying exhausted the parents.","Incessant emails filled his inbox each morning.","The dog's incessant barking disturbed the neighborhood."
ardent,very enthusiastic, passionate, or fervent.,"He is an ardent supporter of environmental causes.","Her ardent desire to succeed motivated her every day.","The fans showed ardent devotion to the team.","She gave an ardent speech about human rights.","His ardent love for music inspired him to compose.","They worked with ardent determination to complete the project."
precept,a general rule or principle intended to regulate behavior or thought.,"Honesty is a precept taught from a young age.","The precepts of the organization guide its members' actions.","She follows the precepts of her religion closely.","The teacher explained the precept of treating others kindly.","The company's precepts emphasize integrity and respect.","He struggled to live by every precept in the code."
resolute,admirably purposeful, determined, and unwavering.,"She remained resolute in her decision despite criticism.","His resolute stance inspired others to join the cause.","The team was resolute in pursuing their goal.","He faced adversity with resolute courage.","Her resolute commitment never wavered.","They were resolute in their quest for justice."
rally,"to come together and recover strength, spirit, or position after a setback or defeat.","The team managed to rally in the final minutes and win.","Citizens rallied to support the disaster victims.","After a tough year, the company rallied and grew again.","She rallied her friends for one last effort.","Investors rallied behind the innovative startup.","He rallied after illness to run the marathon."
milieu,a person's social or cultural environment and surroundings.,"He grew up in an artistic milieu filled with creativity.","The political milieu of the era influenced her writing.","Her ideas were shaped by the academic milieu of the university.","The film captures the urban milieu of New York City.","He found it hard to adapt to a new social milieu.","The business milieu was highly competitive and fast-paced."
prelude,an action or event that serves as an introduction to something more important.,"The argument was a prelude to their eventual breakup.","The overture served as a prelude to the main performance.","His speech was a prelude to the announcement of reforms.","The rainstorm was a prelude to the hurricane.","The book's prelude sets the tone for the story.","Negotiations served as a prelude to the peace agreement."
whittle,to shape or reduce something by cutting small slices or pieces from it.,"He spent the afternoon whittling a wooden figurine.","The committee whittled the list of candidates down to three.","She whittled away at the block of soap until it was smooth.","Budget cuts whittled the project's resources.","Over time, her savings were whittled away by expenses.","He whittled a stick into a small toy for his child."
coiffeur,a male hairdresser, especially one who styles women's hair.,"She booked an appointment with a famous coiffeur in Paris.","The coiffeur skillfully styled her hair for the wedding.","He aspired to become a renowned coiffeur for celebrities.","The coiffeur recommended a new hairstyle that suited her face.","A talented coiffeur can transform one's appearance.","She thanked her coiffeur for the elegant makeover."
whim,a sudden or impulsive idea, desire, or change of mind.,"On a whim, they decided to drive to the beach.","He bought the expensive watch on a whim.","She changed her plans at the whim of her boss.","Their vacation was planned on a whim rather than carefully.","He painted the room blue on a passing whim.","Her whims often led to unexpected adventures."
