word,word definition,Sentence 1,Sentence 2,Sentence 3,Sentence 4,Sentence 5,Sentence 6
deteriorate,"to become progressively worse.","Her health began to deteriorate after the accident.","Relations between the two countries deteriorated rapidly.","The building deteriorated from years of neglect.","The weather is expected to deteriorate over the weekend.","His eyesight started to deteriorate with age.","The situation will deteriorate without intervention."
substantial,"of considerable importance, size, or worth; strongly built or made.","They made a substantial donation to the charity.","The house was substantial and well constructed.","She received a substantial raise at work.","There is substantial evidence to support the claim.","The company achieved substantial growth last year.","He made a substantial impact on the community."
reforms,"changes made to improve a system, organization, or practice.","The government introduced new reforms in education.","Labor reforms improved workers' rights.","The city enacted police reforms after protests.","Financial reforms stabilized the market.","The reforms faced resistance from some groups.","Reforms in healthcare benefited many citizens."
derisory,"ridiculously small or inadequate.","He received a derisory bonus for his hard work.","The offer was derisory compared to the property's value.","They paid a derisory fee for hours of labor.","The compensation was derisory and insulting.","A derisory amount of funding was allocated.","The proposal was dismissed as derisory."
agglomeration,"a mass or collection of things; an assemblage.","The city is an agglomeration of diverse neighborhoods.","An agglomeration of dust gathered under the sofa.","The museum displayed an agglomeration of artifacts.","The festival brought an agglomeration of food trucks.","The agglomeration of ideas led to innovation.","An agglomeration of clouds signaled an approaching storm."
vestige,"a trace or remnant of something that is disappearing or no longer exists.","Only a vestige of the ancient wall remains.","There was not a vestige of doubt in her mind.","The custom is a vestige of medieval times.","The building had vestiges of its former grandeur.","He felt a vestige of regret about his decision.","No vestige of the original forest was left."
psychosomatic,"(of a physical illness or other condition) caused or aggravated by a mental factor such as internal conflict or stress.","Doctors determined his stomach pain was psychosomatic.","Psychosomatic symptoms increased during stressful periods.","She developed a psychosomatic rash before exams.","The illness was partly psychosomatic, according to the specialist.","Psychosomatic conditions often require counseling.","Stress can lead to psychosomatic headaches."
dreary,"dull, bleak, and lifeless; depressing.","The dreary weather matched her mood.","He found the office environment dreary and uninspiring.","The movie was too dreary for a family night.","A dreary landscape stretched for miles.","Her room looked dreary without sunlight.","The novel's plot was slow and dreary."
pollyanna,"a person who is excessively cheerful or optimistic.","He is a pollyanna, always expecting the best outcome.","Her pollyanna attitude can be annoying during serious discussions.","Don’t be a pollyanna; sometimes things go wrong.","The team needed realism, not a pollyanna's optimism.","She was teased for being a pollyanna at work.","Even in tough times, he remained a pollyanna."
protestant,"a member or follower of any of the Western Christian churches separate from the Roman Catholic Church.","He was raised in a protestant family.","The church had a protestant service every Sunday.","Protestant beliefs differ from Catholic doctrine.","Many protestant denominations exist worldwide.","The protestant Reformation changed European history.","She attended a protestant school as a child."
faculty,"an inherent mental or physical power; a natural ability for a particular activity.","She has a faculty for learning languages quickly.","His faculty of memory is impressive.","The university’s faculty is highly respected.","He lost the faculty of speech after the accident.","Her creative faculty set her apart from others.","The faculty of sight is vital to most animals."
immoderate,"not sensible or restrained; excessive.","He has an immoderate appetite for sweets.","Immoderate spending led to debt.","Her immoderate anger surprised everyone.","Immoderate praise can seem insincere.","The critic accused the author of immoderate sentimentality.","Immoderate drinking is harmful to health."
extol,"to praise enthusiastically.","She extolled his virtues in her speech.","The coach extolled the team's hard work.","Critics extolled the film for its originality.","He extolled the benefits of regular exercise.","Parents extolled the school’s achievements.","The mayor extolled the volunteers’ dedication."
abuzz,"filled with a continuous buzzing or humming sound; full of lively activity.","The garden was abuzz with bees and butterflies.","The office was abuzz with rumors about the merger.","Social media was abuzz with the latest news.","The crowd was abuzz before the concert began.","The city became abuzz during festival season.","The school was abuzz with excitement on graduation day."
pomp,"a showy or ostentatious display, especially at a ceremonial event.","The parade was full of pomp and pageantry.","The graduation ceremony was marked by great pomp.","Royal weddings are known for their pomp.","He disliked the pomp of official functions.","The event was held with much pomp and circumstance.","The coronation was a scene of regal pomp."
rapport,"a close and harmonious relationship in which people understand each other's feelings or ideas.","She has a natural rapport with children.","A good teacher builds rapport with students.","They developed a strong rapport over time.","Rapport between coworkers leads to better teamwork.","The therapist worked to establish rapport with her client.","Rapport is essential for effective communication."
elaborate,"involving many carefully arranged parts or details; complicated and detailed.","The wedding featured elaborate decorations and a gourmet menu.","He gave an elaborate explanation of the theory.","They created an elaborate plan for the project.","Her costume was elaborate and colorful.","The design was elaborate and intricate.","It was an elaborate scheme to surprise her."
temperament,"a person or animal's nature, especially as it affects their behavior.","Her cheerful temperament made her popular.","The puppy has a gentle temperament.","Artists often have a sensitive temperament.","He has a fiery temperament on the field.","His calm temperament is an asset in stressful situations.","The horse’s temperament is ideal for beginners."
lopsided,"with one side larger, higher, or heavier than the other; uneven.","The cake turned out lopsided after baking.","The vote was lopsided in favor of the new policy.","She wore a lopsided grin after the joke.","The picture frame hung lopsided on the wall.","The competition was lopsided, with one team dominating.","A lopsided load caused the cart to tip over."
marginalize,"to treat a person, group, or concept as insignificant or peripheral.","Policies that marginalize minorities are unjust.","She felt marginalized in the male-dominated workplace.","The new system marginalized older employees.","Activists fight to prevent marginalized voices from being silenced.","He was marginalized by his peers for his beliefs.","The law marginalized small businesses."
contrition,"the state of feeling remorseful and penitent.","He showed genuine contrition for his actions.","Her contrition was evident in her apology.","The judge was moved by the defendant’s contrition.","Public contrition is rare among politicians.","She prayed for forgiveness and contrition.","Contrition is necessary for reconciliation."
ostinato rigore,"relentless or unyielding rigor, especially in pursuit of perfection.","The musician practiced with ostinato rigore for hours.","His ostinato rigore led to a flawless performance.","The scientist pursued her research with ostinato rigore.","Ostinato rigore is admired in elite athletes.","The chef’s dishes reflected ostinato rigore in technique.","Their training regime was marked by ostinato rigore."
staunchly,"in a very loyal and committed manner.","She staunchly defended her friend against criticism.","He remained staunchly opposed to the proposal.","The organization staunchly supports animal rights.","They staunchly refused to compromise their values.","He is staunchly loyal to his team.","She staunchly advocated for social justice."
marred,"damaged or spoiled to a certain extent; impaired.","The painting was marred by a scratch.","The celebration was marred by an argument.","His reputation was marred by scandal.","The view was marred by ugly power lines.","Her speech was marred by nervousness.","The road was marred with potholes."
idyllic,"extremely happy, peaceful, or picturesque.","They spent an idyllic summer by the lake.","Her childhood was idyllic and carefree.","The village looked idyllic in the morning sun.","The couple enjoyed an idyllic honeymoon.","He painted an idyllic scene of country life.","The picnic spot was simply idyllic."
picturesque,"visually attractive, especially in a quaint or charming way.","The picturesque cottage overlooked the valley.","They hiked through picturesque mountain trails.","The town square was picturesque with cobblestone streets.","A picturesque sunset lit up the sky.","Her photographs captured picturesque landscapes.","We visited a picturesque fishing village."
quaint,"attractively unusual or old-fashioned.","They stayed in a quaint bed-and-breakfast.","The town is known for its quaint shops and cafes.","She lives in a quaint cottage near the woods.","The bookshop had a quaint charm.","I enjoy the quaint customs of the festival.","His writing style is quaint but delightful."
unscathed,"without suffering any injury, damage, or harm.","Despite the accident, she walked away unscathed.","The house survived the storm unscathed.","He emerged from the debate unscathed.","The car was unscathed in the minor collision.","Thankfully, all passengers were unscathed.","Miraculously, the artwork was unscathed by the fire."
palpable,"so intense or obvious as to be almost touched or felt; tangible.","The tension in the room was palpable.","Her excitement was palpable before the concert.","There was a palpable sense of relief after the test.","Fear was palpable among the crowd.","The disappointment was palpable in his voice.","The anticipation was almost palpable."
tangible,"perceptible by touch; clear and definite, real or concrete rather than abstract.","She needed tangible proof of his honesty.","The reward was tangible and immediate.","Tangible results encouraged the team to work harder.","There was a tangible improvement in her health.","He gave her a tangible gift, not just words.","Tangible benefits come from hard work."
solitary,"existing or living alone; without companions; isolated.","The prisoner spent years in solitary confinement.","She enjoys solitary walks in the park.","He led a solitary life after retirement.","The solitary tree stood in the field.","His work requires solitary concentration.","Solitary animals hunt alone."
solemn,"formal and dignified; showing sincerity and deep seriousness.","The ceremony was solemn and respectful.","She made a solemn promise to her friend.","His expression was solemn during the announcement.","They observed a solemn moment of silence.","The occasion was marked by a solemn speech.","He walked with a solemn demeanor."
segregated,"separated or set apart from others, often by force or law, typically referring to groups of people.","The school was segregated by race in the past.","The city remains segregated along economic lines.","They lived in a segregated neighborhood.","The swimming pool was once segregated.","Segregated seating was enforced on buses.","Efforts continue to desegregate segregated areas."
virulent,"extremely harmful or severe in its effects; bitterly hostile or malicious.","The virus was highly virulent and spread quickly.","He launched a virulent attack against his rivals.","Virulent rumors damaged her reputation.","The chemical is virulent if inhaled.","She faced virulent criticism online.","A virulent strain of the disease emerged."
solidarity,"unity or mutual support within a group, especially among individuals with common interests or goals.","Workers showed solidarity during the strike.","The group acted in solidarity with the victims.","International solidarity was crucial during the crisis.","They wore ribbons in solidarity for the cause.","Solidarity among teammates led to victory.","Solidarity can overcome great challenges."
interloper,"a person who becomes involved in a place or situation where they are not wanted or are considered not to belong.","He was seen as an interloper at the exclusive club.","The new manager felt like an interloper at first.","Tourists are sometimes viewed as interlopers in quiet towns.","The interloper disrupted the private meeting.","She was considered an interloper by her classmates.","Interlopers were not welcome in the tight-knit group."
ostensibly,"apparently or purportedly, but perhaps not actually; seeming on the surface.","He was ostensibly there to help, but had other motives.","The meeting was ostensibly about safety, but focused on budget cuts.","She ostensibly agreed, but remained unconvinced.","The company is ostensibly eco-friendly.","They ostensibly support the plan, but express doubts privately.","Ostensibly, the rule is for safety."
solace,"comfort or consolation in a time of distress or sadness.","She found solace in music after her loss.","His friends offered solace during tough times.","Reading provided solace from daily stress.","The garden was a place of solace for her.","He sought solace in prayer.","Solace came from unexpected kindness."
faltering,"losing strength, momentum, or confidence; hesitant or unsteady.","Her faltering voice betrayed her nerves.","The project moved forward at a faltering pace.","He took faltering steps after the surgery.","Their faltering resolve soon gave way to doubt.","Faltering sales worried the management.","She offered a faltering apology."
bastion,"a stronghold or fortified place; something that defends or preserves a particular principle, activity, or group.","The university is a bastion of free thought.","The fortress served as a bastion against invaders.","The newspaper became a bastion of independent journalism.","He is a bastion of honesty in his field.","The group is a bastion of tradition.","Civil liberties are a bastion of democracy."
mull,"to think about deeply and at length; to ponder or consider.","She mulled over the job offer for days.","He mulled his options before making a decision.","They mulled the idea during their meeting.","I need time to mull things over.","He mulled the consequences of his actions.","She mulled whether to move abroad."
tepid,"only slightly warm; showing little enthusiasm or interest.","The coffee was tepid by the time he drank it.","Her response was tepid and unenthusiastic.","The pool water felt tepid on a hot day.","His support for the plan was tepid at best.","A tepid welcome greeted the guests.","Sales remained tepid throughout the year."
revitalized,"given new life, energy, or strength; rejuvenated.","The community was revitalized by new businesses.","She felt revitalized after a long vacation.","The company was revitalized with fresh leadership.","Revitalized parks attracted more visitors.","The campaign revitalized public interest.","He revitalized his routine with new activities."
aide,"a person who assists another, especially a superior, in carrying out their duties.","The senator's aide organized the press conference.","She worked as a teacher's aide for two years.","The general relied on his aide for information.","The aide prepared the documents for the meeting.","A presidential aide briefed the media.","He asked his aide to schedule an appointment."
debilitating,"making someone very weak or infirm; causing a loss of strength or ability.","The disease had a debilitating effect on his health.","She struggled with a debilitating headache.","Debilitating injuries ended his sports career.","The heat was debilitating in the summer.","He endured a debilitating depression for months.","Debilitating fatigue forced her to rest."
perturbed,"feeling anxious, unsettled, or upset.","She looked perturbed by the unexpected news.","He was perturbed by the sudden changes at work.","The noise perturbed him while studying.","Her perturbed expression worried her friends.","The delay perturbed travelers at the airport.","He felt perturbed by the criticism."
cohesion,"the act or state of sticking together tightly; unity or forming a united whole.","Strong cohesion within the group led to success.","The glue provided cohesion for the model.","Cultural events promote cohesion in communities.","The team showed great cohesion during the project.","Cohesion is important for effective teamwork.","Lack of cohesion can cause problems."
smorgasbord,"a wide variety or diverse assortment of something.","The buffet offered a smorgasbord of international dishes.","The event featured a smorgasbord of activities.","She has a smorgasbord of interests.","The festival was a smorgasbord for food lovers.","A smorgasbord of options awaited the shoppers.","Their playlist is a smorgasbord of genres."
lucrative,"highly profitable; producing a great deal of money or benefit.","He found a lucrative job in finance.","Real estate can be a lucrative investment.","The deal proved to be very lucrative.","Lucrative contracts attracted top talent.","She started a lucrative side business.","The company launched a lucrative product line."
radically,"in a thorough or fundamental way; completely or extremely.","The policy changed radically after the election.","She radically altered her lifestyle for health.","Technology has radically transformed communication.","His views are radically different from mine.","They renovated the house radically.","The business model was radically overhauled."
sterility,"the inability to produce offspring; barrenness.","The couple struggled with sterility for years.","Sterility can be caused by medical conditions.","Laboratory sterility is crucial for experiments.","The drought led to sterility of the land.","Sterility treatments are available at the clinic.","Sterility affected the farm's productivity."
repertoire,"a stock or collection of skills, techniques, works, or items that a person or group can perform or use.","The actor has a vast repertoire of accents.","Her repertoire includes classical and jazz pieces.","Chefs build a repertoire of signature dishes.","He expanded his repertoire of programming languages.","The comedian's repertoire is always growing.","The team practiced their repertoire of plays."
ineluctable,"impossible to avoid or escape; inescapable.","Change is an ineluctable part of life.","They faced the ineluctable reality of aging.","The outcome seemed ineluctable from the start.","Death is an ineluctable fate for all.","He accepted the ineluctable conclusion.","The ineluctable truth was finally revealed."
meander,"to follow a winding, intricate course; to wander aimlessly without urgent destination.","The river meanders through the countryside.","We meandered around the city with no plan.","Her thoughts meandered during the lecture.","The path meandered through the forest.","Tourists meandered through the art galleries.","He likes to meander through markets on weekends."
imbibe,"to absorb or take in, especially ideas or knowledge; also, to drink (especially alcohol).","He likes to imbibe local culture when he travels.","She spent the evening imbibing wine with friends.","Students imbibe knowledge from their teachers.","He imbibed wisdom from his mentor.","The soil imbibes water after the rain.","She imbibed the details of the new project."
visceral,"relating to deep inward feelings rather than intellect; emotional or instinctive.","She had a visceral reaction to the news.","The film evoked a visceral response from the audience.","His visceral fear of heights kept him grounded.","Visceral instincts often override logic.","The speech was moving on a visceral level.","He trusted his visceral sense of danger."
prodding,"encouraging or urging someone to take action, often by persistent persuasion.","After much prodding, he agreed to apply for the job.","Her mother's prodding got her to clean her room.","With gentle prodding, the student spoke up.","Prodding from friends convinced him to join.","He succeeded thanks to constant prodding from his coach.","The project moved forward with some prodding."
panorama,"an unbroken, wide view of the whole region surrounding an observer.","The hotel room offered a panorama of the city.","We admired the mountain panorama at sunrise.","The painting captured a panorama of rural life.","They took a photo of the whole panorama.","From the rooftop, the panorama was breathtaking.","The app allows you to create a panorama image."
vantage,"a position or place that provides a broad or advantageous perspective or view.","From her vantage point, she could see the parade.","The tower provided a perfect vantage over the valley.","He found a vantage to photograph the wildlife.","The hilltop was a strategic vantage in battle.","The window seat gave him a vantage on the street.","The path led to a vantage overlooking the bay."
fruition,"the point at which a plan, project, or idea is realized or completed successfully.","Their hard work came to fruition with the product launch.","The plan finally reached fruition after years of effort.","She saw her dreams come to fruition.","The project was brought to fruition by teamwork.","Funding ensured the idea's fruition.","The event came to fruition on schedule."
mired,"stuck or entangled in something difficult or unpleasant; bogged down.","He was mired in debt after the failed venture.","The negotiations became mired in disagreements.","The truck was mired in the muddy field.","She felt mired in paperwork at her new job.","The country is mired in political turmoil.","The case was mired in legal complications."
ecstasy,"an overwhelming feeling of great happiness, joy, or bliss.","She was in ecstasy when she heard the news.","His face showed pure ecstasy after the victory.","The concertgoers danced in ecstasy.","Winning the award filled him with ecstasy.","They hugged in ecstasy at the airport.","The painting depicts a moment of ecstasy."
cornucopia,"an abundant supply of good things; a symbol of plenty and nourishment.","The market was a cornucopia of fresh produce.","Her garden is a cornucopia of flowers.","The website offers a cornucopia of resources.","The fair had a cornucopia of food vendors.","A cornucopia of ideas came from the brainstorming session.","He received a cornucopia of gifts for his birthday."
raison d'etre,"the most important reason or purpose for someone or something’s existence.","Art became his raison d'etre.","The charity's raison d'etre is helping children.","Her family is her raison d'etre.","Education is the school's raison d'etre.","The project lost its raison d'etre over time.","The company's raison d'etre is innovation."
siphon,"to gradually or stealthily take something away, especially resources or funds, often illegally or unfairly.","They siphoned money from the company’s accounts.","The project siphoned resources from other departments.","Water was siphoned from the tank to the garden.","Corrupt officials siphoned funds for personal gain.","He siphoned gas from his neighbor’s car.","The scandal involved siphoning donations."
lurid,"very vivid in color, especially so as to create an unpleasantly harsh or unnatural effect; also, gruesome or shocking.","The tabloid featured lurid headlines about the crime.","The painting’s lurid colors clashed with the décor.","She disliked lurid details in horror stories.","Lurid photos filled the front page.","The sunset cast lurid light on the clouds.","He told a lurid story at the campfire."
amount,"to be equivalent in seriousness, effect, or value to something.","His actions amount to a confession of guilt.","The damages amounted to thousands of dollars.","This change amounts to a major overhaul.","Lying to the court amounts to perjury.","Her efforts amount to a significant achievement.","The delay amounts to a breach of contract."
tempestuous,"characterized by strong, turbulent, or conflicting emotions.","Their tempestuous relationship was full of drama.","The debate grew increasingly tempestuous.","He wrote about his tempestuous youth.","A tempestuous argument erupted at the meeting.","The artist’s life was tempestuous and passionate.","She endured a tempestuous few years."
plunge,"to jump or dive quickly and energetically; to suddenly descend or immerse.","He plunged into the cold water without hesitation.","Stock prices plunged after the announcement.","The car plunged off the bridge during the storm.","She plunged into her studies for finals.","The temperature plunged overnight.","He took the plunge and started his own business."
invalid,"a person made weak or disabled by illness or injury; also, not valid or legally acceptable (context-dependent).","She cared for her elderly invalid mother.","The password you entered is invalid.","He became an invalid after the accident.","The contract was declared invalid by the court.","Invalid claims will be rejected automatically.","He felt trapped by his status as an invalid."
